id,user,date,timestamp,commentText,likes,hasReplies,numberOfReplies,replies.id,replies.user,replies.date,replies.timestamp,replies.commentText,replies.likes
z12mgz1hctridjxkl23ww1bovmqcwbbm2,Uri Baruchin,6 months ago,1459745825356,That is the most MORONIC trailer I have ever seen. An important POINT of the book is not knowing whether they make it out or not.,0,false,0,,,,,,
z13ejzewqnrnjhjrm04ccfmoiwmrhz3ilqk0k,Hristo Urumov,6 months ago,1459745825357,the song is: MS MR - All the things lost,0,false,0,,,,,,
z13lzzqwmqvyyromd22se1rgxvqgwdtok04,julie villarreal,6 months ago,1459745825357,"I love this movie so much, I could watch it a million times. Thanks, dad for telling me about it!!!",0,false,0,,,,,,
z13qjro5ymz2xdj4x04cgjwbzm2rxlvwzio,Brittany Edwards,6 months ago,1459745825358,kute little boy tho,0,false,0,,,,,,
z122v3uxrpatxxot2233z1zwkpzgizbvp,Brittany Edwards,6 months ago,1459745825358,"after dey escaped outta the room... the rest of the movie wuz bland. after dey escaped, there wuz still a whole 45 minutes left of the movie... I thought sumtn else intriguing wuz gonna happen 2 keep us tuned in",0,false,0,,,,,,
z12fz5pgelfehla4o04cgxi4uyzzw1l5fm00k,AgitatedJim Wallace,6 months ago,1459745825359,"Does anyone know what that music at 1:15 is? It's in the Moneyball trailer too and I've always wanted to know what it is. And no, I'm not talking about ""All the Things Lost"" by MS MR",0,false,0,,,,,,
z122u3qphwemefuik04cctzglxudwxboc4k,Jun 11,6 months ago,1459745825359,Does anyone know the song that starts at 1:15 and ends around 1:31? Sounds very similar to Explosion in the Sky's style to Lone Survivor.,0,false,0,,,,,,
z12tcj54glafitp3e22qjjjbwrnqc3deu,Arani Sivakumar,6 months ago,1459745825360,"I think this movie was based on the poem by Seamus Heaney, ""ByeChild"", very similar attributes though I could be very wrong as well. The poem was about a little boy and a mother who were held captive in a henhouse for several years, until the boy escaped and helped the escape of the mother as well.",0,false,0,,,,,,
z13huh2zdmircjbp104cdbuh5orkwliwfco,youssef Rcs,6 months ago,1459745825360,One of the best movies I've ever seen,0,false,0,,,,,,
z13psztb3xaluhjmo23wu34jxteywh1ao04,Laura Momsen,6 months ago,1459745825361,anyone knows the name of the song at 0:31? thanks!,1,true,1,,,,,,
,,,,,,,,z13psztb3xaluhjmo23wu34jxteywh1ao04.1458380211615046,oussama bakkach,6 months ago,1459745825529,Ms mr : all the things lost,0
z131snzrdt3cdx5fb234fd0ijrjgc33sj,Turquoise Cheetah,6 months ago,1459745825361,I just saw the movie on demand. it was the most beautiful yet solemn movie I have ever seen.,0,false,0,,,,,,
z13mwtbous2wzvhgy04cfbbypvvwwj2is5w,Human Being,6 months ago,1459745825362,"Just watched this movie! God, what an amazing story. Anyone knows similar movies like that with just amazing storylines?",1,true,3,,,,,,
,,,,,,,,z13mwtbous2wzvhgy04cfbbypvvwwj2is5w.1457951131643508,ShottyPipes LTD,6 months ago,1459745825737,+Aziz M Yes! The road. That is very similar in certain ways.,0
,,,,,,,,z13mwtbous2wzvhgy04cfbbypvvwwj2is5w.1457982124188509,Human Being,6 months ago,1459745825738,"Alright, thanks!",0
,,,,,,,,z13mwtbous2wzvhgy04cfbbypvvwwj2is5w.1458360233471036,Bitch of Rome Entertainment,6 months ago,1459745825738,"+Aziz M Similar story lines would be hard to really find, but if you want something with the same sort of feel, that has the pace, emotional journey and blow away writing and acting, I found ""Room"" very similar to ""The Spitfire Grill"" - an older film now but still one of the best ever made. ""Changling"" might be a good suggestion as well with some of the story elements I guess - and also being inspired by true events.",0
z12jchghatn5vfbn1222v5hovweos5x3r,WastedYom,6 months ago,1459745825362,1:07... SUUUURRRREEEE...,0,false,0,,,,,,
z12mh3a4alzfxlsqn04cgjjq4vmwvpn5nlo0k,uco dex,6 months ago,1459745825363,"Damn good movie, that boy is a great actor, and brie",0,false,0,,,,,,
z13eh3foqza4hb5ml22dv3qadv2dyhpzy04,MANDINGO SHANE DIESELBLACKCOCK,6 months ago,1459745825363,"I WANNA SMELL AND LICK MICHELLE RODRIGUEZ FEET , TOES AND SOLES . I BET THERE NICE AND GOOD STINK .",0,false,0,,,,,,
z13nht244wzyhnbmx224h3woiwytvjt5h04,smirzahussain,6 months ago,1459745825364,That trailer just ruined the whole movie?! Why show everything?,0,false,0,,,,,,
z13xxhpbkyybcnfsz234s5150uy4imks,Kimberly Lorena,6 months ago,1459745825364,The most beautiful trailer I've ever seen,0,false,0,,,,,,
z130w3o5ukn5wla2b22ljfzqqyuayjdpm04,Berfin içten,6 months ago,1459745825365,❤,0,false,0,,,,,,
z13luxgp1vbkxl1je04cij0auzvdilmhlek,Eithar Qasim,6 months ago,1459745825365,what is the name of this song 1:30,0,false,0,,,,,,
z13mz5ri4yzbvdf0g23sxbga4xiud5t20,MsDamzie,6 months ago,1459745825366,"This was an excellent movie! Watched it b4 seeing the trailer & all its spoilers 😡 Just one thing - who would carry the body of a presumably dead child in a truck that way? Hadn't it occured to him that a sharp corner would have sent the ""corpse"" tumbling out and exposed to pedestrians or traffic police? Oh, wait, it's just a movie 😐",0,false,0,,,,,,
z13qc50wcze0v3uoo04cg53hirmsirgpb4w,Tarun Mourya,6 months ago,1459745825366,"when you watching a movie some movies makes you smile and feels happy and some movies when you watching them they make you cry with full of emotions. But this one is make you cry and make your smile at same time. """"its really really so much full of emotion and a movie that no one give it rank in stars its a tale of emotion that spread from heart to heart if you have a heart so you also cry and smile at same time when you watch this. its just for feel please dont compare it with star ranking.",0,false,0,,,,,,
z12wxhjr1wrtc1bqg04chfbpksa0db0y250,spooky,6 months ago,1459745825367,is anyone else here from Josh dun?,0,true,1,,,,,,
,,,,,,,,z12wxhjr1wrtc1bqg04chfbpksa0db0y250.1458234723679590,Daha Mohamed,6 months ago,1459745825878,no nigga,0
z12cdjsyrnj1zfx2322odpe4fqq4hxydc,IcecreamKat,6 months ago,1459745825367,What's the name of the song at the end of the trailer?,0,false,0,,,,,,
z12cx3lomob3jrakj234v5ph2wq3unjgv04,‫עדן אנטופולסקי‬‎,6 months ago,1459745825368,"I work in a cinema so I can go to movies for free there, but I would totally pay for the three times I've seen it! And Brie TOTALLY deserved that Oscar, I only wanted to watch the darn Oscars to see if she, Jacob and the movie win.... Too bad Jacob wasn't nominated (can't children be nominated?). While Brie was amazing, you have to be at awe at Jacob who didn't have as much years to study acting for that performance. If you haven't seen the movie, go see it",0,false,0,,,,,,
z12gd33r3tzzwbqud234eb0hml3ytvy2u,Haya A. Imraish,6 months ago,1459745825368,This is the most heart-breaking movie ever! Very Sad. I have never cried in my life as much as I cried watching this movie. I watched it a week ago and until this moment I can't stop thinking about it!!,1,true,1,,,,,,
,,,,,,,,z12gd33r3tzzwbqud234eb0hml3ytvy2u.1457760752481101,Hazel Abraham,6 months ago,1459745826075,"Same here, just watched it last night and it still haunts me this moment! Jacob is truly a wonder child.",0
z13aebzrgmbrutd0i22ocjoouofhy5n5z04,Streamtrooper,6 months ago (edited),1459745825369,"If you watched the trailer and feel like shit after reading the following comments below saying how the trailer spoiled the movie for you, well... simple solution that worked for me. Don't watch the movie for a few days. Forget that you saw the trailer (you will) Then before you decide to watch it, don't ever look at the trailers. You'll be fine.",0,false,0,,,,,,
z13dx3yp3yzdyvx1a22zfjtzru2fer2bc04,Valerie Tsang,6 months ago,1459745825369,watched this. so amazing,0,false,0,,,,,,
z12dcv1ogty1ebuwo04cfjpgmvqyzd5b3yc0k,kan ballack,6 months ago (edited),1459745825370,this film make me crying since 127 hour.,0,false,0,,,,,,
z122ybkqxxaqhrrzs04cjr4h3pawij2xl0c,ThatTurtle2003 SwiftTurtle2003 (swiftturtle2003),6 months ago,1459745825370,I cried watching this movie,0,false,0,,,,,,
z13ghlf5hsb5zh0pg04cevdghmr4zhfw1ko0k,Elizabeth Draper,6 months ago,1459745825371,im here because top,0,false,0,,,,,,
z13nin3okna1cfjfh235hllhbu2fcfnr204,Caleb Howard,6 months ago,1459745825371,Movie got really boring towards the end,0,false,0,,,,,,
z13edpgh0trzwhmeu23zfbbyzu3jfz2og04,llgla,6 months ago (edited),1459745825372,This reminds me of the case a few years ago where 3 women held captive for a decade were found when one of them sees an opportunity (Captor forgot to lock the front door and she got the attention of a neighbor to help tear off the door mesh). It's scary to think there might still be undiscovered cases out there.,0,false,0,,,,,,
z13kslhyfvf2ftvde23ohdnqlmu4hddnq,TheMrFreshPrince1,6 months ago,1459745825372,It's just a movie. It's just a movie. That's what I keep telling myself before crying.,2,true,4,,,,,,
,,,,,,,,z13kslhyfvf2ftvde23ohdnqlmu4hddnq.1457585700236796,llgla,6 months ago,1459745826297,+TheMrFreshPrince1 You can't ignore the news though. I have read a couple cases that happened similarly. I know not all men are bad. It just doesn't look good on men when such cases are revealed.,1
,,,,,,,,z13kslhyfvf2ftvde23ohdnqlmu4hddnq.1457586040873072,TheMrFreshPrince1,6 months ago,1459745826298,+llgla I see but what does that have to do with my comment?,0
,,,,,,,,z13kslhyfvf2ftvde23ohdnqlmu4hddnq.1457588670464972,llgla,6 months ago (edited),1459745826299,+TheMrFreshPrince1 That you think it is just a movie but it is actually inspired by real events.,0
,,,,,,,,z13kslhyfvf2ftvde23ohdnqlmu4hddnq.1457596763509997,TheMrFreshPrince1,6 months ago,1459745826300,+llgla Oh wow I didn't know it actually happened. I've myself heard couple horrifying kidnapping stories and some movies weren't well interpreted. This film Room is probably the first for me.,0
z122ijur0yj5dzahj04cilpaiuafclp5ais,TheMrFreshPrince1,6 months ago,1459745825373,"""Jack, the world is so big. This room is just small stinky part of it."" That got me.",0,false,0,,,,,,
z12fgz0wzk34s3q5p04cg3i54nmyhxewlgk,Akiahh,6 months ago,1459745825374,"I've just finished watching this film and I've never in my life been so sad, happy, angry, and on the edge of my seat through one film! The most gripping film ever. A must watch, absolutely incredible!",0,false,0,,,,,,
z12xvpyzborksnpq204cftyx4pmkwdozyuo0k,gloglo1414,6 months ago,1459745825374,For a moment I thought that it was jennifer lawrence singing D:,0,true,2,,,,,,
,,,,,,,,z12xvpyzborksnpq204cftyx4pmkwdozyuo0k.1457585868741887,llgla,6 months ago,1459745826505,"+gloglo1414 ""Are you, Are you, Coming to the tree...""",0
,,,,,,,,z12xvpyzborksnpq204cftyx4pmkwdozyuo0k.1457586905205959,gloglo1414,6 months ago,1459745826506,+llgla lol exactly :),0
z12ksf450un3z5zf322kwlrhnozgixmqi04,Génesis Garcia,6 months ago,1459745825375,I totally regret seeing this trailer before the movie....,1,false,0,,,,,,
z12cfbhy5ymxunndj22aet4j2tv1wddr404,galen taylor,6 months ago,1459745825375,"why does she say ""I want him to feel safe?"" Isn't jack a girl?",0,false,0,,,,,,
z12osdvrqru0dxseb22pvdoynumqep1vb,Supratik Sarthak,6 months ago,1459745825376,"Room is probably one of the most inspiring yet terribly disturbing movie I have ever watched. Superb casting, great dialogue and an incredible way of storytelling through brilliant camera work has left me in pieces",0,false,0,,,,,,
z12wjdzxnly5sjms123gzj0apzjet5mjd04,Ana Costa,6 months ago,1459745825376,Does anyone know the name of the song of the 2 part of this trailer?,0,false,0,,,,,,
z13xd1iwpuikythx104cgrdpcxf5xxjbffg,Genelia AG,6 months ago,1459745825377,seriously 1:16 I cried,0,false,0,,,,,,
z12lvvsgtyunvfftx23mfforpxbkfxf3j,Federica Celeste,6 months ago,1459745825377,What is the song present in this trailer? I can't find it. Can you help me?,0,false,0,,,,,,
z13lebkhhyufvvfht04cepxqaousspy4yjw,dory jr,6 months ago,1459745825378,Im glad i didnt watch the trailer before the movie because when i started watching it i thought it was a fantasy of the boy's imagination. It felt sci-fi like but then as the movie progressed my understanding of the situation grew with Jacks understanding and i thought that was a great film technique.,0,false,0,,,,,,
z12zjfuxlzmwwlohr04cjnyianukhh2r0tk0k,Chronical Factory X - Let's play,6 months ago,1459745825378,"Hoped this would be ""The room"" remake :( O hai Mark!",0,true,1,,,,,,
,,,,,,,,z12zjfuxlzmwwlohr04cjnyianukhh2r0tk0k.1457931070717951,Jules Darko,6 months ago,1459745826650,oh hai doggie,0
z13dvrhammryhhnnw22chl15jljaun4yw04,Charlotte Atkinson,6 months ago,1459745825379,What's the song at 1:15? I don't think it's All Things Lost,0,true,1,,,,,,
,,,,,,,,z13dvrhammryhhnnw22chl15jljaun4yw04.1457806808285865,Alma lindström,6 months ago,1459745826802,+Charlotte Atkinson The mighty rio grande-This will destroy you,0
z13mvtlq3oudvzjqx04cjfs5crngy3gqqng0k,Ember LPS,6 months ago,1459745825379,I LOVED THIS MOVIE SO GOOOOOOOD,0,false,0,,,,,,
z130df4g1oaegjhsj22ye3nrpruzc12rc04,KittenQueef,6 months ago,1459745828497,so glad i didnt see this trailer,1,false,0,,,,,,
z12lh3fwizyxfxzmp22xg1lhuuqajjrw404,Christian Osmancevic,6 months ago,1459745828497,Jacob Tremblay is amazing!,1,true,1,,,,,,
,,,,,,,,z12lh3fwizyxfxzmp22xg1lhuuqajjrw404.1457760659167831,Hazel Abraham,6 months ago,1459745828690,OMG yass! He was sooo convincing! Ive never seen such brilliant performance by a child actor before. He should've atleast earned a nomination here for Academy.,0
z135dzlbkr22edntv23yelnijnevexxmx,allnoni,6 months ago,1459745828498,this tráiler is so spoiler! am so happy i saw the movie before watched this.,0,false,0,,,,,,
z12udp4pzsymvxnjj04civtwakquuhtp30o,Ellen Collins,6 months ago,1459745828499,I cried at this trailer and I very rarely cry. I don't know how I'll handle this movie,0,true,1,,,,,,
,,,,,,,,z12udp4pzsymvxnjj04civtwakquuhtp30o.1470650668106533,Ellen Collins,1 month ago,1472965028842,I didn't handle it well,0
z13tvncratfxcntda235h1swtkfaylmz104,d8nya1,6 months ago,1459745828500,Anyone know the song that's playing in the bg?,0,false,0,,,,,,
z122flq4nr2fu3j4504ccrow3wbjzhajpng0k,Alex Jbf,6 months ago,1459745828501,Spoilers much?,0,false,0,,,,,,
z13dth2jdvalvhijh04ccfdisuvxxxabv1o,Samm “Sabeena” Bee,6 months ago,1459745828501,The book is amazing and this movie is really incredible.,0,false,0,,,,,,
z12osjt4otrxx1izn04cibygtuv4cva5rc0,Cathy One1,6 months ago,1459745828502,"I went to see 'Room'. it is a harrowing film which depicts the painful story of a captivity. For me its a film about coming out of captivity and how people react to something they cannot relate to. It had smacks of true crime cases such as the 'Ariel Castro' case and the 3 girls held in his house and a child born to him within the 10 years, and also the 'Josef Fritzl' case who abducted his own daughter for 24 years by design and incestuously abused her resulting in her having... 7 children to her own father. The themes of 'Room' touches on so many ie the bond between mother and son and its strength, how the child does not know that there is a real world outside of the 4 walls and has never felt rain or sun on his skin, sexual abuse and molestation, reuniting 'with world', fitting in, heroism, courage, the media, the family unit, isolation, depression, resources, imagination, the power of play, the power of language, what freedom means, perception, relationships, the police and how they handle or don't handle these kind of crimes, the recovery process and many more..Powerful film that will stay with you long after you have left the 'room'.",0,false,0,,,,,,
z12liztbgkjhwp0oy04cen3rtxuxzzbatvs0k,Danny Bate,6 months ago,1459745828502,Could make a sequel called Ecuadorian Embassy starring Julian Assange,0,false,0,,,,,,
z12twdqwyrj4xxmdl23ju5jqrmisur1jm04,highwaymaintainer,6 months ago,1459745828503,"Yep, that was a good movie",0,false,0,,,,,,
z13uyx1b0xvndx22g23nwrl5wymnuhcbj04,Chantale Bouchard,6 months ago (edited),1459745828503,Does someone know the song? ♥♥,0,false,0,,,,,,
z13wetfzilfovfpl122xu3by4s2fjbkvw,Arina Alex,6 months ago,1459745828504,👍,0,false,0,,,,,,
z13isf5qfne4h1oim04chp3znmjijlyxuaw,Justyna Szymankiewicz,6 months ago,1459745828504,do you know whats is that song at the end? pleeeeease im looking forit everywhere,0,true,1,,,,,,
,,,,,,,,z13isf5qfne4h1oim04chp3znmjijlyxuaw.1457386549352984,Justyna Szymankiewicz,6 months ago,1459745828989,"+Justyna Szymankiewicz nevermind, found it, if anyone is wondering just its ms mr 'all the things lost'",0
z121t51xykamctca404cfbfjexutwneyksk0k,L- xo,6 months ago,1459745828505,Can we all just take a moment to appreciate the little boy's acting...,0,false,0,,,,,,
z135dbzheq2israfs22bdzmxhtyoh1hpq04,Bagus Kumolo,6 months ago,1459745828505,Room Full Movie now available in HD quality only in https://plus.google.com/117027204282385151791/posts/67EZRBmJGyA,0,false,0,,,,,,
z12yu5urrlqngjuu522zj5coitehvb4fa,bicooo1,6 months ago,1459745828506,I don't know I feel like this movie will emotionally destroy me,7,true,1,,,,,,
,,,,,,,,z12yu5urrlqngjuu522zj5coitehvb4fa.1457732334819561,Haya A. Imraish,6 months ago,1459745829152,"+bicooo1 trust me, it will!",1
z12btxximveejnrvo23tyfir5puhtx5b204,rascal ;,6 months ago,1459745828506,"I did watch the trailer before and I agree that they show a bit too much, but it was still beyond fantastic. Even the escape scene. It was everything cinema is about, emotion, love, human stories and struggles. Truly an experience that shook me emotionally and that was flawless acted and directed. Still thinking about it.",0,false,0,,,,,,
z13gunagxxycczmxp04cep05jsv3ffkatb0,Bulletofmess,6 months ago,1459745828507,You've just ruined the movie for me 😐,0,false,0,,,,,,
z13ghtyxftfwfbvbs04cc1tg2qbjdfdycnk0k,Anxietygirl,6 months ago,1459745828508,is this based on a true story?,0,true,1,,,,,,
,,,,,,,,z13ghtyxftfwfbvbs04cc1tg2qbjdfdycnk0k.1457448545520106,Olivia Åkerbergz,6 months ago,1459745829307,"No, the author of the book stated that it's not.",0
z12furr5axrzghlah04chdhzgn3wcvjxczs0k,Sione Taufa,6 months ago,1459745828508,I only searched this movie up because of the Oscar awards. Definitely looks like a good movie,0,false,0,,,,,,
z135jv2plruavz2fk22retarpwfhint2p,TheLexi Gt,6 months ago,1459745828509,can someone tell me why I can't watch is it because it's bad? or something?,0,false,0,,,,,,
z13qvhwpxoqqfxj2w23tftdreofiwpry204,sizzorgirl67,6 months ago,1459745828509,Fuck that movie is a tear jerker,0,false,0,,,,,,
z12rxxxggqesvpvzu04cgp3o2p3pehw50w40k,Ivan Rodriguez,6 months ago,1459745828510,"I just saw the movie and I loved it, I only thing I did not like was her dad, your daughter has been missing for seven years and you leave because she has a baby by her rapist, he couldn't even look at his grandson. Jack doesn't know anything about how he became to be just that he was born.",3,true,1,,,,,,
,,,,,,,,z12rxxxggqesvpvzu04cgp3o2p3pehw50w40k.1457504779304079,Sal Sirchia,6 months ago,1459745829508,It was Frank Gallagher what do you expect.. 😂,0
z134z1pgoovvzpu5j04cen1jnkezdbuyfek,Josue Aguirre,6 months ago,1459745828510,song,0,false,0,,,,,,
z133yrwwfya4u3dwo04ccvir3rqteh5xlts0k,Victor hugo Prado,6 months ago (edited),1459745828511,what is the trailer for the music?,0,false,0,,,,,,
z12gvburxk3vwbofn23mh3xziqywgdyv3,Jen Tuesday,6 months ago,1459745828511,"To those who haven't seen this film and happened to read the comments first, DO NOT WATCH THE TRAILER FOR THIS FILM BEFORE WATCHING IT! This film is something that nobody should miss out on, but seriously the trailer is a total spoiler for pretty much everything. I'm so glad I didn't see the trailer before I watched the movie. First movie that ever made me cry.",2,false,0,,,,,,
z12cx1tr2oubxxx5m04chxqq2sekytkbmpw0k,Nikotiini,6 months ago,1459745828512,Does the kid just have long hair or is he transgender? I find it a bit confusing. Especially in the scenes after the escape.,0,false,0,,,,,,
z12xutuxhwalhhpmf22sgbpaumvuxpnb304,Cutieepatutiie,6 months ago,1459745828512,I saw the movie before this trailer my heart is done,0,false,0,,,,,,
z13fvlmjju2phjtnx22aujnjsrb2g5qnw,Creakush Coliko,6 months ago,1459745828513,Movie of the year!,0,false,0,,,,,,
z121ipwg2rjefvuyz04ccl3iqpfrepyjxzw0k,Christian Vinquen,6 months ago (edited),1459745828513,"A 'Room' without Tommy Wiseau, it's like October without Halloween and December without Christmas",0,false,0,,,,,,
z12wtd5xdmi3vph4f04cjtcr3mv3hpcradc,Natalie ONeill,6 months ago,1459745828514,I love this movie,0,false,0,,,,,,
z12lvbvb5ouoxfiwu04chdjyitqzd1nb2jc,cicakgemuk,6 months ago,1459745828514,"what, the trailer spoils everything :0",0,false,0,,,,,,
z13nfdaplrrod5l0p22nw1t4wleqxns4504,TheCanihavaname,6 months ago,1459745828515,This trailer is basically the whole movie.,0,false,0,,,,,,
z133xzng0piiglb1b22jhz4wiqvdchuob04,Niou Niou,6 months ago,1459745828515,This kid is just so beautiful and the movie is impossible to keep your eyes away from,0,false,0,,,,,,
z13gyborfw3yzxrjg04cib2gjt23hdlaz44,Dubbsgamer 34,6 months ago,1459745828516,"this is my favourite film,Brie Larson is my favourite actress.I saw all of her films,like this comment if she is ur favourite actress.",0,false,0,,,,,,
z13qtfgphkbxdbah004cjvtxamelx5yzpy40k,Gary White,6 months ago,1459745828516,Best movie I've ever seen,0,false,0,,,,,,
z12tv5gotzidd3oj004cibzwpyanxlpraes,Chalron Bjork,6 months ago,1459745828517,It is so very obvious why Jacob won best young actor 2016 - he is AMAZING in this movie; I have never seen a child so young act so amazing - so real and so very deep. What a champ this little fella is; I am excited to see more of his movies,1,false,0,,,,,,
z12vudtjhtmtdlz5004chlnqjwqyt5mp1as,F khatz,6 months ago,1459745828517,the best movie ever,1,false,0,,,,,,
z12nh5rpgzz1gnbsv234v305mk25ednc5,Donny chalmers,6 months ago,1459745828518,"Why do I even need to watch the movie, the whole plot was basically spoiled in the god damn trailer",0,false,0,,,,,,
z125shwryle1sjptz23qyjarku3igpvlf,Harish Indra,6 months ago,1459745828518,he's like a girl :'D,0,false,0,,,,,,
z130fnab5pr0h5m2u23xvbfjfwetcljvk,teppolundgren,6 months ago,1459745828519,"SPOILER ALERT! Don't blame me if you read on. Anyone else like me who went into this one, not knowing anything about it? I was utterly convinced that grandpa Leo would be involved in it all, since he had a dog. The ONLY dog in the film. And what did the kidnapper use to kidnap ""Ma""? A DOG. Overall, it was a good film with some impressive acting. But I thought it would be a thriller, and not a story about coping with extreme personal and emotional trauma.",0,false,0,,,,,,
z12pv5nhnqznvforl04ccfuq1ryhg5c5r0c,Sofia Rose,6 months ago,1459745828519,i watched this yesterday and was bawling the whole time,0,false,0,,,,,,
z123ytdomlrhfvhil04cgdwabsvocrvavv40k,Ava Bee,6 months ago,1459745828520,it was making me shake the whole movie cuz its so nerve racking,0,false,0,,,,,,
z12xfrhzeymzwzdpj04cfdnggxb2hv5hpqo0k,gregg mikulla,6 months ago,1459745828520,"The best ending would've been a final cut scene of a grown up Jack locating the abductor, clubbing over the head knocking him out, waking up hog tied, with Jack repeatedly raping him for weeks in an abandoned building with a tire iron, cutting off his penis and feeding it to him, and then setting him on fire. Don't tell me that wouldn't be satisfying",0,false,0,,,,,,
z12euv5xoxrkznszk04cghwowu2eehrxdb0,Rafael Villaça,6 months ago,1459745828521,"This is not how you make a trailer. Thanks God I watched this wonderful movie, before watching this.",0,false,0,,,,,,
z122enzzcseah3svs22zzxpogpbjwhnuj,toadman2723,6 months ago,1459745828521,thank god i didn't watch the trailer before i saw the movie.,0,false,0,,,,,,
z124tlgrgmyag1dpp04ccxsgwqzawnkwv1c,Yuri tr,6 months ago,1459745828522,Massive spoilers,0,false,0,,,,,,
z12xyjgbopbyd5ral04cizao1zfcxncy304,Nicole Vlogs,6 months ago,1459745828522,I really wed to see this movie😁😁,0,false,0,,,,,,
z12jd1ljbnrbxtksd23xfv4avyahgp3wv04,Jasmine Thompson,6 months ago,1459745828523,I watched this today amd crued so much,0,false,0,,,,,,
z12bhtjycpeozt3s323th1fhrtmswryaa04,Stacy4R,6 months ago,1459745828523,I finished the book last night and I can't wait to see the movie today :),0,false,0,,,,,,
z13rcnazco3nhbt5304cjb1zixfoehtxfrg0k,AceofMetal,6 months ago,1459745830921,"Just when I thought how come they don't make these great movies anymore comes this piece of gem, no words can describe this film but its the most emotional touching straight to your heart film ever made and is just perfect in every way, all this I say to you after 40 years of watching movies",0,false,0,,,,,,
z12wydejxwurwbjo004cff1xqyq2yrf5uss0k,Raymond Mack,6 months ago,1459745830921,An Oscar well deserved. This was way better than Lawrence's performance in Joy.,1,false,0,,,,,,
z12vdhfhyke3z54s322te3hqdvagcfdou04,siddharth nagar,6 months ago,1459745830922,Brie Larson is beyond brilliant in this film...,0,false,0,,,,,,
z12xtbezgtqdv3ge323osloomu25jn0vs,Mickey Moose__,6 months ago,1459745830922,Jack looks like my friend Ehxea,0,false,0,,,,,,
z12pij1qvk22dl3sz23osloomu25jn0vs,Mickey Moose__,6 months ago,1459745830923,Just saw the movie last night such a good story but it's sad to think that the window on the top of the shed and room was the only world Jack knew😨😥😢😞😕,0,false,0,,,,,,
z13kgb0z5yrltpkwl04cdb2otpe4e3jp3gk,lchoii,6 months ago,1459745830923,"As much as these comments talk about how much they wish they didn't know that they escaped, i think the beauty of the movie doesn't come from whether or not they escaped, but more so in their story together... in their mother-son relationship and how they got through the entire situation, before and after the escape.",0,false,0,,,,,,
z13fjhtghlzzdtgea23avjd4ummwyxrdc,Amina Mushtaq,6 months ago,1459745830924,can anyone tell me the name song this video has??,0,false,0,,,,,,
