id,user,date,timestamp,commentText,likes,hasReplies,numberOfReplies,replies.id,replies.user,replies.date,replies.timestamp,replies.commentText,replies.likes
,,,,,,,,z13kvzrajwupypskv23qwvma5on4vzhxl04.1452822638260752,♡venuz_babi♡,8 months ago,1454561857064,+SeaBiscuit well I read it many years ago like 2011 but I never thought it'd be a movie,0
z12kghdjpnuwxtb3w225zxyqiya1zhift,Ricky Downes (RickyFIFAHD),8 months ago,1454561854475,"this movie is up there with Shawshank, godfather... amazing movie",0,false,0,,,,,,
z12zhnyanxnogf4mp22wwpi55r3vihxel,Dmitry Prosvirnin,8 months ago,1454561854476,Room | Official Spoiler HD. This film is wonderful. Trailer is too detailed.,0,true,2,,,,,,
,,,,,,,,z12zhnyanxnogf4mp22wwpi55r3vihxel.1452822741645666,Mephostopheles,8 months ago,1454561857266,"The film isn't just about their escape. If that were the case, it would happen at the end rather than only halfway through. Rather, it's about the change, and the adaptation to a whole new lifestyle, a new world, for Jack and even for Ma. This is why the book was split into two big parts, one part before the escape, and one part after.",1
,,,,,,,,z12zhnyanxnogf4mp22wwpi55r3vihxel.1460277876833037,jamie456781,5 months ago,1462337857267,"+Mephostopheles I see your point but it's still a huge spoiler they revealed. Imagine watching the scene before the truck scene and then remembering the parts they show in this trailer where he escapes and is reunited with ma. I would be hella pissed off. Since I didn't watch this trailer first, the scene was so powerful, so emotional and tense wondering how the escape is going to happen, if he succeeds, what will happen to ma and so on. I get the escape is not the main part of the movie but it's still very irresponsible to show significant parts of the film.",0
z12ih1dxmljiv1ebq04ce3b4trikfte4h30,Grace Handy,8 months ago,1454561854476,Oh my god she's in 21 jump street,65,true,7,,,,,,
,,,,,,,,z12ih1dxmljiv1ebq04ce3b4trikfte4h30.1452977175244177,Seanh2k11,8 months ago,1454561857504,"+Grace Handy She's an actress, funnily enough, an actress acts in multiple movies, she's also in ""Short Term 12"" another stunning movie.",26
,,,,,,,,z12ih1dxmljiv1ebq04ce3b4trikfte4h30.1453048213568733,Clorox bleach,8 months ago,1454561857504,+Grace Handy yes Molly from 21 Jump Street,0
,,,,,,,,z12ih1dxmljiv1ebq04ce3b4trikfte4h30.1453496244876233,Grace Handy,8 months ago,1454561857504,"+Seanh2k11 sorry I was just surprised hadn't seen her in a while , ??",2
,,,,,,,,z12ih1dxmljiv1ebq04ce3b4trikfte4h30.1455921799591066,Junior Rossoni,7 months ago,1457067457505,+Grace Handy Gotta say that took me a while to realize she also plays Envy in Scott Pilgrim vs the World,2
,,,,,,,,z12ih1dxmljiv1ebq04ce3b4trikfte4h30.1456729658508451,fruityxoxo1991,7 months ago,1457067457505,"+Grace Handy HOOT, Scott Pilgrim vs the world..",3
,,,,,,,,z12ih1dxmljiv1ebq04ce3b4trikfte4h30.1460888460438747,Matthew Huylebroeck,5 months ago,1462337857506,+Seanh2k11 shut the fuck up,0
,,,,,,,,z12ih1dxmljiv1ebq04ce3b4trikfte4h30.1460889044261500,Seanh2k11,5 months ago,1462337857506,+Matthew Huylebroeck i think you need to grow up pal.,1
z12pgttpnxmvirf4004cgdmqcqjtjdpa5yw0k,Stephen Corbally,8 months ago,1454561859338,"the add doesn't even tell atall what the films about, why the fuck are they even in that room to begin with??",0,false,0,,,,,,
z13rzhezbx2zurn2n23zg3eaolzldda5104,Ephemeral Liberty,8 months ago,1454561859339,She's come a long way since Hoot,1,false,0,,,,,,
z121fjmzisenyhlrm04cdhsxtnndwjoaqrg0k,Effy Elviani,8 months ago,1454561859340,"This movie was so sad 😢 I'm crying a lot. Jack: ""Next week you better ask me for the Candle"" Ma: ""Next Year you mean"" 😢😢😢😢😢 This is the Beat Movie ever",0,false,0,,,,,,
z124dnm4mtjjj3sun232vr5bzyyvvpqsh,Charlie p,8 months ago,1454561859340,omg this is like my favorite book ever.,0,false,0,,,,,,
z13lux0b2srrufe0522fibigwuj3x1ppv04,Effy Elviani,8 months ago,1454561859341,This kid would be the assets of Hollywood 👌,0,false,0,,,,,,
z13rfjpy2pujt3ayt04cebyqhpztzx1zz4w,Morpheus Davorre,8 months ago,1454561859341,"this isnt a girl? oh my god, never could have guess it was a boy",0,false,0,,,,,,
z13dcx4giruwhtrv522purdbdp21gjb4p04,Melissa Whisenant,8 months ago,1454561859342,is this based on the true story of that sick man who kept his kid/s locked up in a basement and raped her/them? It just seems very similar but didn't see any comments about the relation.,0,true,2,,,,,,
,,,,,,,,z13dcx4giruwhtrv522purdbdp21gjb4p04.1452822295117368,Mephostopheles,8 months ago (edited),1454561859501,"You mean Josef Fritzel? Yes. That&#39;s exactly what it's based on. He held his daughter captive in his basement for twenty-four years, and she bore him seven children, three of which he raised normally, four of which were kept in the basement, and one of which died shortly after birth due to breathing defects.",0
,,,,,,,,z13dcx4giruwhtrv522purdbdp21gjb4p04.1453939899417936,Kariel Cloud,8 months ago,1454561859501,+SeaBiscuit really??,0
z12pexkj4pn0sxvxn04ccvlxkzqhwrygrqc0k,Sick of Stupid ppl,8 months ago,1454561859342,"Brie just won the golden globe !!!! aaaaahhh so amazing, she totally deserve it !!!!!",0,false,0,,,,,,
z12xihaplxu1hrgxn04ccdcwfpvezd4ws5o,errlo09,8 months ago,1454561859343,"its so tragic but somehow a beautiful movie. cant compare it to anything, hope it does well through award season",0,false,0,,,,,,
z12mzd14qy3yf3lbp04cctaw3se2vlvw42o,JP McFluffies,8 months ago,1454561859343,Great book. Look forward to seeing the movie!!,0,false,0,,,,,,
z12psfezisrger2ij04ccjdjxpyjd55gvfg,Marcel Körner,8 months ago,1454561859344,Oh hy Mark,0,false,0,,,,,,
z131tfracpnrurllg23ky1w4iobluftnu,Chloe Rothwell,8 months ago,1454561859344,amazing,0,false,0,,,,,,
z12gj1sh0laletnft221ezyr3necjptn0,ShadowZeal,8 months ago,1454561859344,"Does this movie even have a plot? Seems like nothing happens for a few hours then everyone wins Oscars because it was ""interesting""",1,false,0,,,,,,
z12lfhy5buemjhky104cg30xwvihddwpn4g,kdbyers,8 months ago,1454561859345,Ok I'm a bit lost. Is it a little girl or a little boy? They call her Jack but looks exactly like a little girl. Am I missing something here? Never read the book so not sure whats going on.,0,true,2,,,,,,
,,,,,,,,z12lfhy5buemjhky104cg30xwvihddwpn4g.1452822550915693,Mephostopheles,8 months ago,1454561859644,"He is a boy. He simply looks like a typical little girl because A) he's young, and little boys can sometimes look like little girls (that's just how it is), and B) he was held captive for five years, his whole life, without a haircut, so of course he's got long hair. Besides, boys can have long hair, just like girls can have short hair. It's hair, it isn't defined by gender.",7
,,,,,,,,z12lfhy5buemjhky104cg30xwvihddwpn4g.1452825004579652,kdbyers,8 months ago,1454561859645,"Ok thanks, that seems to make sense know.",0
z123tlgasvqpxxpjb04ceb0yruilgbdp3mo0k,Perri Neill,8 months ago,1454561859346,Wow!!! I cannot wait to see this :),0,false,0,,,,,,
z12ny3rhao35zhwty235cjmoruymyloqo04,LOIZOS V,8 months ago,1454561859346,... and the winner is Jack (Jacob Tremblay) . He is an amazing little actor! I think there were two mistakes at the movie: 1. Τhe colour of Jack's hairs were darker than when there were short and 2. Since the movie was filmed in Canada it was lie Jack to say we are in America and in the planet,0,false,0,,,,,,
z12dxhxr1pnbitrma23qddcz1mz5gdq3p,reby sully,8 months ago,1454561859347,wait jack is a boy....,2,true,4,,,,,,
,,,,,,,,z12dxhxr1pnbitrma23qddcz1mz5gdq3p.1452350172530297,Little Tuna,8 months ago,1454561859853,+reby sully Wow good observation,0
,,,,,,,,z12dxhxr1pnbitrma23qddcz1mz5gdq3p.1452350361804808,reby sully,8 months ago,1454561859853,thanks legit didnt know,0
,,,,,,,,z12dxhxr1pnbitrma23qddcz1mz5gdq3p.1456425159198821,Symon Alex,7 months ago,1457067459854,+reby sully i saw the whole movie knowing that that's a girl,0
,,,,,,,,z12dxhxr1pnbitrma23qddcz1mz5gdq3p.1456785136578814,reby sully,7 months ago,1457067459854,+Symon Alex right the first time i realized he wasn't was when in the hospital he was wearing boy underwear and i was like what... and he was bare chested,0
z13dxtmxrkawth1x504cjltbnxnqutqqsow0k,Batool Jamal,8 months ago,1454561859348,such a unique idea,1,true,1,,,,,,
,,,,,,,,z13dxtmxrkawth1x504cjltbnxnqutqqsow0k.1452448814922185,CrisSevieri TV,8 months ago,1454561860007,+Batool Jamal unique? watch Old Boy son,3
z13eg52q0nmtv5mfi22of5qy0rvndzhg204,Forrest Robinson,8 months ago,1454561859348,I love how this trailer signifies the true meaning of this movie - experiencing the world like you've never seen it before; rather than acting like a suspenseful thriller about escaping captivity.,2,false,0,,,,,,
z12iil1p3pivg5pzt04ccbaz5tehgptpggk,Madame Choice,8 months ago,1454561859349,Did somsone know what is that music? Help plss,1,false,0,,,,,,
z13vjxkbrpjwfzqab04cinirgyrwzldadiw,Niall Murphy,8 months ago,1454561859349,What is the song in the trailer? please and thanks,0,false,0,,,,,,
z13fxrirpofactqgj04cebtqgszoc3pxcwo0k,Kwak Kwak (ThreeStars),8 months ago,1454561859350,NPR anyone?,0,false,0,,,,,,
z13qjxaitzbjszla504cijfzpq3jwx2bn50,Futurescped,8 months ago,1454561859350,want to watch this but feel might be to depressing,0,false,0,,,,,,
z12hw5whisfvvzntw22qwrirbuundxc5y04,Reema Alowerdi,8 months ago,1454561859351,is it a TRUE story???,0,false,0,,,,,,
z13fibmrkrnnzvmsc23tt15bornlj42k,Too Sneaky,8 months ago,1454561859351,"weird enough this movie sounds particular. like that one guy who kidnapped those girls and had them hostage for more than a decade if I remember correctly, and one of the girls gave birth to a girl and by the time they were found out (about 3 years ago) the girl was 5 or less. but it does remind me of that.",0,false,0,,,,,,
z13qijnwllyxhftqx04cdxvxcxfyubowli4,Vinesauce Fan,8 months ago,1454561859352,"When watching this movie, you can take note of a couple of these things. It's cool to see them all come together. - Jack saying ""Good morning"" to all things in Room. - Jack's temper tantrums. - Ma's the only person Jack's ever talked to. - Ma's bad tooth. - Ma's hurt wrist. - Old Nick's behavior toward Jack, and Ma's protection. - Alice in Wonderland book. - Jack's long hair. (This one is very interesting. It's very big later.) - Jack wanting to see a REAL dog. - ""TV World"" - Ma's father's behavior towards Jack. - ""I'm your Ma. Sometimes, I have to pick for the both of us.""",0,false,0,,,,,,
z12ehfxwlsqcetrpf04ch51hqwaycb0re3s,Artsneighbor,8 months ago,1454561859352,What song are they using at the end?,0,true,1,,,,,,
,,,,,,,,z12ehfxwlsqcetrpf04ch51hqwaycb0re3s.1452350256967375,Little Tuna,8 months ago,1454561860155,+Artsneighbor All the Things Lost by MS MR,0
z13qefihusqsyjfup22lhhqpuui0eh1ii04,majed Alzahrani,8 months ago,1454561859353,If you don't cry or shed a tear during this movie i think you don't have a heart.,0,false,0,,,,,,
z13mg1niaufqfp0to23kgxqbbq2kejqiz04,Tony Maher,8 months ago,1454561859353,i'm glad I didn't see this trailer before the movie. The tension of the escape and not knowing if Jack would make it or if the kidnapper would go back and do something to Ma was phenomenal,0,false,0,,,,,,
z13zxvkpdlu5jr1iz04cdfogppa4wp0q0xw0k,Spike Isaacs,8 months ago,1454561859354,all the things lost- mr ms (is the main song xx),0,false,0,,,,,,
z12pdjrroy2rzn1fh22ex35hdlb5c5kbj04,Spike Isaacs,8 months ago,1454561859354,song please...,0,false,0,,,,,,
z12kenwadujnf12wj04cgbsgqnm3c5m4w1o,Zayed Shorafa,9 months ago,1451883459354,I never read the book but after I saw the movie I bought the book and the story was so amazing,0,false,0,,,,,,
z132gv0phryyexw2p223f3hzguzzfff1p,Katja Maretić,9 months ago,1451883459355,Why are they even in that room????,0,true,1,,,,,,
,,,,,,,,z132gv0phryyexw2p223f3hzguzzfff1p.1451958911372797,Celestial,8 months ago (edited),1454561860304,+Katja Maretić Spoiler alert~ Brie Larson's character was kidnapped at a young age and has been locked/raped there by her captor,0
z13swl5qkrzzibc0p225fvrhszeciji1w,SevenEllen,9 months ago,1451883459356,"0:36 - 0:37 ""Thank you"" ""to"" ""everyone"" ""who"" What??? What's with the broken English?",0,false,0,,,,,,
z12zvp3brwyzfnoat04cd5xhntj0v1javzw0k,Hype Williams,9 months ago,1451883459356,Eh. 21 jump street girl.,0,false,0,,,,,,
z12fejubapfwvn4wf04ccfai0pi0yvewa2o,mia black,9 months ago,1451883459357,I HAVENT READ THE BOOK YET DAMN IT,0,false,0,,,,,,
z13bebvajly0sr4gv04ceh3gwufdef4qc5k,Cobi Hilliard,9 months ago,1451883459357,I love this movie,0,false,0,,,,,,
z12zgzyhlrvkixumf23idrqa5yiay5pvq,LACHGAR VISION,9 months ago (edited),1451883459358,"Omg all the time i thought He was a girl, and I'm asking myself why they call him like a boy,'cause He really look like a little girl.",0,false,0,,,,,,
z12ydvgzytvgjjw1322jhd2ift3yij4p404,Raquel Wells,9 months ago,1451883459358,"This movie is AMAZING, MUST SEEE",0,false,0,,,,,,
z13thvr4ryrrv1olz23kuloxhpjldrsqh04,Kamillia C,9 months ago,1451883459359,i just power read through this book now i HAVE to see the movie omg,0,false,0,,,,,,
z12yfnrj5mersdfpl04cenhx5tyqgrqyar40k,Markus Arike,9 months ago,1451883459360,"Brie Larson is favored to win Best Actress and she will win, for sure. She was so, so good, there will be no denying her.",0,false,0,,,,,,
z121gz0h2vi4gpvfx23zynswewyyvflz304,Hannah Grippo,9 months ago,1451883459360,Anyone know the song playing through the second half? Or who the singer is? Thanks!,0,true,1,,,,,,
,,,,,,,,z121gz0h2vi4gpvfx23zynswewyyvflz304.1452350131801932,Little Tuna,8 months ago,1454561860446,"+Hannah Grippo It's ""All The Things Lost"" by MS MR :)",1
z12lfderdpzoets4h04cjrazenelhd0hszk0k,Margox P,9 months ago,1451883459361,Hope Brie gets an oscar nom and win!!!,0,false,0,,,,,,
z12hvreauzafjfgac04cdd1piqrlwdnontk0k,Bat Man,9 months ago,1451883459361,I watched the movie it was on fleek👌👌👌👌👌👌👌👌👌👌👌 but also really sad I cried😩😩😥😥😧😧 when I saw him escape I was like😱😒😱😭😭😭😭😭 awww I give this move 37483826273839396367000000002737376474883937775848498557773726515437844848383940883837474848484949383873737166262638481537375383618473731237338838 likes,0,false,0,,,,,,
z12fvj2ahtidc1bik04cep0ygzatsvqbnwg0k,zeytin çilek,9 months ago,1451883459362,soundtrack ?,0,false,0,,,,,,
z13stbhauqeiufrku235vlxztlnwv3aft,Eloise T,9 months ago,1451883459362,SO CANT WAIT FOR THIS TO COME OUT!!!,0,false,0,,,,,,
z13muneb4vjovff0o23sz1qxhnr4cbiuu,Carley,9 months ago,1451883459363,I honestly can say that this movie is one of the best movies I've ever seen,2,false,0,,,,,,
z12wdrsberuyxppcb22vdvhjbkyev1vox04,Jeff Suttles,9 months ago,1451883459363,More backhanded trans obsession by Hollywood and their writers. Please try again.,0,true,3,,,,,,
,,,,,,,,z12wdrsberuyxppcb22vdvhjbkyev1vox04.1451757017094603,Ore B,9 months ago,1451883460601,+Jeff Suttles what trans obsession? the boy in the move is not trans.,0
,,,,,,,,z12wdrsberuyxppcb22vdvhjbkyev1vox04.1451958963349931,Celestial,8 months ago,1454561860602,"+Jeff Suttles What the hell? There's no trans characters in this movie, and even if there was, it wouldn't matter.",0
,,,,,,,,z12wdrsberuyxppcb22vdvhjbkyev1vox04.1452028234211614,Sterling,8 months ago,1454561860615,+Jeff Suttles that's one idiotic ignorant comment. Please try again.,1
z13vyvyqkracwj1e2225dhxp5yriiback,Tiago Goulart,9 months ago,1451883459364,"What a masterpiece, the trailer spoils it but I'm glad I didn't watch it before the film",0,false,0,,,,,,
z12nyh55jvqshz4mr22xdjtwiummcxu4404,Alexandra Arrieta,9 months ago,1451883459364,"Such a wonderful and awe-inspiring book. The trailer is very deceiving, but beautifully put together so that anyone that hasn't read the book won't know any spoilers. I implore you to read the book before watching the movie. It's narrated by 5-year-old Jack and he tells the story of how Room is his whole world with his Ma.",0,false,0,,,,,,
z121sf3i2tbwymfskzvgjpbhon23xl2s1,Asia Lundien,9 months ago,1451883462025,where can I find this movie! I wanna watch it so bad,0,false,0,,,,,,
z13ih5qhbp2zspu4f04ccxvygp3xsbqb14g,Beatix - Back,9 months ago,1451883462026,My favourite 2015 movie,0,false,0,,,,,,
z123sfqacpalgfihd04cdzdzapjbcvhh3w40k,‫روعه الصبيخي‬‎,9 months ago,1451883462026,اني شاهدته في سيلمه كان حيلو مخيف وسبب لي القشعريره,0,false,0,,,,,,
z13vhraa1sauzp2fe22jcvnx2xaszvisz,Sarah Shenkan,9 months ago,1451883462027,"what an incredible touching movie it was. by far one of the best movies i watched for years. a big recommendation to this one. deserved an oscar in every category. leading actress, script, directer, author....",0,false,0,,,,,,
z12ozdrwnzyof1t2z22jcvnx2xaszvisz,Sarah Shenkan,9 months ago,1451883462027,"what an incredible touching movie it was. by far one of the best movies i watched for years. a big recommendation to this one. deserved an oscar in every category. leading actress, script, directer, author....",0,false,0,,,,,,
z12sd5whpmerzx2l222pzzr5avridl1nv,illumiNancy,9 months ago,1451883462028,OMG CAN YOU NOT!?!?!?! LIKE LEGIT MY EYES HURT SO MUCH AFTER WATCHING THIS!!,0,false,0,,,,,,
z12ch32o4la2v5ju222ie3iwatzci534l04,Caffeinated Book Puppy,9 months ago,1451883462028,"The best part of the film, in my opinion, was everything because without seeing how it was in the room, how it became after wouldn't be as satisfying to watch. The whole thing made the movie great for me. What it was like in Room showed me how great a mother can make a bad situation seem great for her son with some imaginative thinking. She was mentally strong, but everyone has their breaking point... The movie was simple, straightforward, and beautiful in my opinion. The simplicity made it so.",0,false,0,,,,,,
z12gebsjcrvxs5fkx22jtruzlp3gzvqs5,Ningamer X,9 months ago,1451883462029,"never read the book, but i dont feel like the adapting part makes sense in a movie, they try so hard but just no, the best part in the movie is they in the room",0,false,0,,,,,,
z13hznlbhnzeihu3223sdxijywbjj1usr,Pamela Kazadi,9 months ago,1451883462029,what's the name of the song?,0,false,0,,,,,,
z13hgvbbjo3vv3juy23jjhmjdyaoujr1p,Richard Herrera,9 months ago,1451883462030,Does anyone happen to know the name of the song in 1:22 ?,0,false,0,,,,,,
z13ixvhwlzuhf1tcp23wwhp5ssivcx4hi04,Freddie Grace,9 months ago,1451883462030,"I have watched most of the movies this year that are Oscar contenders such as ""Carol"" and ""Spotlight"" and they NO where as good as ""Room""!",0,false,0,,,,,,
z13pulci3r3vdzx2g23qwhhrmw3kcpn0b,Myra Monterroso,9 months ago,1451883462030,i dont understand this,0,false,0,,,,,,
z13hxrpbckv0tzj0v22dirtr0wrqixdng,Thecoolkid MC,9 months ago,1451883462031,One of the best movies ever,0,false,0,,,,,,
z12mvvrpqr3pjbzet23mirdwezbjubzs1,Caitlin Phillips,9 months ago,1451883462032,no matter how good this film looks I honestly don't think it could beat the novel,0,false,0,,,,,,
z12exh2gpsj4exbva23ovfeooqunclwhr04,Lara Q,9 months ago,1451883462032,"Man, this film got me right in the gut.",4,false,0,,,,,,
z12oc1sqykqhi3cjk04cf5fhfrzjux4xqig,SammyNoNo,9 months ago,1451883462033,Oh hai Mark,0,false,0,,,,,,
z13zj5eposfef1jbf04cdr5olle0sjwqkgk,John Logan,9 months ago,1451883462033,An essential piece of film.,0,false,0,,,,,,
z12sfhaj4si1jnldo23bsjlqbzyadlnt4,Carlo Fabio,9 months ago,1451883462033,DON'T WATCH THIS F*CKING TRAILER THAT GIVES AWAY THE WHOLE MOVIE.,1,false,0,,,,,,
z13uc53himbpz1cpn04cfx0i1ybuulyyen40k,Nathyk,9 months ago,1451883462034,This movie is brilliant! A delicate subject very well treated. I didn't know there was a book before so amazing book/movie. That kid is a great actor.,0,false,0,,,,,,
z13rvbxqhpfsvvypf04chh2qiva1e13illc0k,Bella Reyes,9 months ago,1451883462034,I watched the movie its really good,0,false,0,,,,,,
z130j33przzjcj4s122zip1b2nfayxney,leisurelydinner,9 months ago,1451883462035,"movie was kinda cheesy, but still pretty good.",0,false,0,,,,,,
z13dgllpmyzvxrkha04cj3tqgpmehn5hkis,zulez smith,9 months ago,1451883462035,OSCAR BAIT: THE MOVIE,1,false,0,,,,,,
z13wfbiq3sach52q304ccndhrsrajnmwhxo0k,Ali Osborne,9 months ago,1451883462036,I read this book in like 2010 and ever since then it's kept me up for loads of nights coz it's so flippin scary I HATE IT but it's a good book but I still HATE it agrhghhh,0,false,0,,,,,,
z13tupooqlqfuxoey22ehzthomntv30yl04,Barcelonista 93,9 months ago,1451883462036,Frank is that you?,0,false,0,,,,,,
z13tilbibqzzvhbp004cgnfbaqvywhrxmqo0k,aiham mohamed,9 months ago,1451883462037,great movie!,0,false,0,,,,,,
z133vlragv3qefsl022iilug2szpylszo04,Michelinej78,9 months ago,1451883462037,"Just finished watching this Movie, awesome, great acting, that kid was amazing!",3,true,3,,,,,,
,,,,,,,,z133vlragv3qefsl022iilug2szpylszo04.1451411623109056,scorpion,9 months ago,1451883462198,+Michelinej78 where did you watch it?,0
,,,,,,,,z133vlragv3qefsl022iilug2szpylszo04.1451412246248799,Michelinej78,9 months ago,1451883462198,+scorpion http://zmovies.me/watch-room-2015-online-free-putlocker/,0
,,,,,,,,z133vlragv3qefsl022iilug2szpylszo04.1451413473683752,scorpion,9 months ago,1451883462199,Thankyou,0
z12dfxgybriyszquk22kuxuppwmcizhbq04,Swapnil Official,9 months ago (edited),1451883462038,This is easily one of the most deeply moving things I've seen on screen!,0,false,0,,,,,,
z125wbwpjnapi3ms1222jjiznlbbtnea204,SuperFashionWorld,9 months ago,1451883462038,"The movie looks nice with good acting, but I'm confused as to why they are in that room. Were the mom and kid kidnapped? Or did the mom do a sociological experiment with the kid?",0,true,3,,,,,,
,,,,,,,,z125wbwpjnapi3ms1222jjiznlbbtnea204.1450485391853540,Diane,9 months ago (edited),1451883462349,"+SuperFashionWorld-- it was really good. the girl was kidnapped when she was 17 and u will find out about the little boy..i don't want to spoil too much...here's a link to watch it, i thought it was fabulous.. http://putlocker.is/watch-room-online-free-putlocker.html",0
,,,,,,,,z125wbwpjnapi3ms1222jjiznlbbtnea204.1450516760844065,SuperFashionWorld,9 months ago,1451883462350,+Diane So the mom was kidnapped and had the kid in captivity? Makes more sense. Thanks for the link.,0
,,,,,,,,z125wbwpjnapi3ms1222jjiznlbbtnea204.1450537375127956,Diane,9 months ago,1451883462351,"@Superfashionworld--yes, that is right, that was her son with her kidnapper and you're very welcome for the link..",0
z131jp5r5w2pjtwtq23yzpfweke3gp0yh04,EyeHi,9 months ago,1451883462039,I'd recommend watching this movie WITHOUT watching the trailer. Go into this movie knowing nothing.,1,false,0,,,,,,
z13ezhvrrrqudfsgr04cj3f5gribi1rquj0,Linda Mena,9 months ago,1451883462040,I'm going to buy it,0,false,0,,,,,,
z12pvjzy5onguxtn0225t3ybox22jzfmj,Darlene Gallagher,9 months ago,1451883462040,it is such a great movie please watch room,0,false,0,,,,,,
z13ztrp4ov3mvnykc224ynibfkv2un1di,Andrew Bedingfield,9 months ago,1451883462040,Is that a girl playing a boy. Or is that an actual boy?,0,false,0,,,,,,
z13uw1pikojfurwry04cid4wkyb1dlczrck,Farid Rasuli,9 months ago,1451883462041,"One of the best movies i've ever watched. Highly recommended!! Honestly, I did not expect this movie to be this good. It went beyond my expectation.",0,false,0,,,,,,
z12xf1vbqoiychbya04cenlr1o32yhggk4o,Daniel Hammond,9 months ago,1451883462041,This was an extremely good movie!!! Definitely deserves some Oscar's for the performances.,3,false,0,,,,,,
z13xtl5xvlz4hpxtc23msxkx3wnowr1sm,Tamsin Bananas,9 months ago,1451883462042,holy fuck just watched this if this doesn't win best picture then i dunno what,0,false,0,,,,,,
z13xet0obnn3fzy1122ktfuofxjjijtm4,(My-Anne),9 months ago,1451883462042,Go watch this movie. It's really really good! Just do it. Go watch it. Seriously.,0,true,1,,,,,,
,,,,,,,,z13xet0obnn3fzy1122ktfuofxjjijtm4.1451411605839197,scorpion,9 months ago,1451883462574,+(My-Anne) where did you watch it?,0
z13zx1koup3gzt11l230el2onojvgta0s,Brandi Sodemann,9 months ago,1451883462043,love this movie,0,false,0,,,,,,
z13txtb4txu4eznp004chflzetulv1q55fw,Michael Robison,9 months ago,1451883462043,and now i don't need to watch the movie... thanks trailer for giving it away,0,false,0,,,,,,
z13kxpugtubcxls2r23nhps4fmyfd1n2g,ArpholomuleNutt,9 months ago,1451883462044,"It's not THE Room, it's JUST Room!",0,false,0,,,,,,
z13afznj1q2gjfmbh04cj5o4pxauurprzsw0k,krlitos,9 months ago,1451883462044,"why the fuck are they in a room in the first place? were they kidnapped or something. doesnt make sense, doesnt seem like there is a kidnaper or something. I dont want to start watching it and then it sucks",0,true,3,,,,,,
,,,,,,,,z13afznj1q2gjfmbh04cj5o4pxauurprzsw0k.1450361823003435,Ian Levinson,9 months ago,1451883462765,"+krlitos The mom was kidnapped as a teenager and was raped which is why she has the kid. Watch it, its an excellent movie",13
,,,,,,,,z13afznj1q2gjfmbh04cj5o4pxauurprzsw0k.1457178545074645,margine louis,6 months ago,1459745862766,based on a real story. room is the only world the kid has ever known. he's never felt rain or a breeze or grass etc it's really good you should watch it,1
,,,,,,,,z13afznj1q2gjfmbh04cj5o4pxauurprzsw0k.1457196217408633,krlitos,6 months ago,1459745862767,"i did watch it a while ago, and tho sometimes im not a big drama fan unless is really good. This movie was excellent, the actress i think won and oscar and i think is well deserved. Movie was amazing, i was kinda crying the whole movie lol",0
z12ozn4zpzrzcxmbt04cj5o4pxauurprzsw0k,krlitos,9 months ago,1451883462045,"why the fuck are they in a room in the first place? were they kidnapped or something. doesnt make sense, doesnt seem like there is a kidnaper or something. I dont want to start watching it and then it sucks",0,false,0,,,,,,
