id,user,date,timestamp,commentText,likes,hasReplies,numberOfReplies,replies.id,replies.user,replies.date,replies.timestamp,replies.commentText,replies.likes
,,,,,,,,z131vhqbgvvgi3rzb04cg34a3p21spjjfh4.1454137647455215,M ....,8 months ago,1454561846655,awards for most boring film of 2016,0
,,,,,,,,z131vhqbgvvgi3rzb04cg34a3p21spjjfh4.1454138291167445,bones bnb,8 months ago,1454561846656,Yeah.. Don't want to argue with a person like you. Go watch your Star Wars. Peace~,0
,,,,,,,,z131vhqbgvvgi3rzb04cg34a3p21spjjfh4.1454139089797872,M ....,8 months ago,1454561846656,"nah, ill stick with my telletubbies",0
z12ftblxgzmdz3ofw22vclkikzaheruyu04,FoamSchool,8 months ago,1454561846453,Ive been reading the book but I never knew there was a movie :o,0,false,0,,,,,,
z13egrcr5re4ifjfx221w1fblq2vchpbn04,Marshall Lee,8 months ago,1454561846453,OMG A GOOD MOVIE ITS LIKE SEEING A RARE ANIMAL,0,false,0,,,,,,
z13xdbgwupjhxpjuh22ezba5kuqxtrti404,ysmbl,8 months ago,1454561846454,"this was great. also check out Cleveland Abduction, and 1096 Days in Captivity. those are actually true stories! Also Prisoners just because that is a damn good movie :)",0,false,0,,,,,,
z125ftlahmnwjfsex23ujd4jjmecwdmqh04,KingLouis51,8 months ago,1454561846454,Can't believe how much this trailer spoils the movie. So please I watched it before seeing this.,0,false,0,,,,,,
z12qtprpivnldjdej22fsxyxxp34cp3re04,Richard Parker,8 months ago,1454561846455,"im gonna smoke a fat blunt tomorrow night, order a 50 piece mcnugget, and watch this movie. afterwards, im gonna smoke another fat blunt and go to Baskin Robbins. and then im gonna go home and type my review.",0,false,0,,,,,,
z12vwpuhntymennsa23hxvnjitqxzjsmg,NeoDracula,8 months ago,1454561846455,"YOU""RE TEARING ME APART LISA Oh, wait. Sorry, wrong movie.",1,false,0,,,,,,
z13dc1ghcqahdj5y104cgbhj0knkzzej12c,AK.,8 months ago,1454561846456,The best movie in 2015,0,false,0,,,,,,
z12fs1pjmujethy2023thrlpxnu2w3zmw,Liliana Davis Ramos,8 months ago,1454561846456,what''s the song's name?,0,false,0,,,,,,
z13wcrai4nvsh3nnf22sxhkzisncuvmss,Osama Maryan,8 months ago,1454561846457,Such a great movie. Very emotional.,0,false,0,,,,,,
z13rf3tgkrecdbkcx22zznv4kqm4gli4q04,takis peristeris,8 months ago,1454561846457,1 .57 min name song?,0,false,0,,,,,,
z12xfpnrfx3yu3idv22zdlbonnettbs0y,Tim Sloper,8 months ago,1454561846457,"This movie was amazing. You will feel all the feels. Hate, Love, Sadness, Triumph. The movie has almost no score b/c the performances and material were that powerful. Best movie I've seen in years.",0,false,0,,,,,,
z125ijsbdnatglydp221wdhifsf2xnpj404,Gina Gisselle,8 months ago,1454561846458,love this movie :),0,false,0,,,,,,
z13xwfk5ps2cznlwz04cjzepgsmqhxpj1dw,F Δ N † A .,8 months ago,1454561846458,I want to fucking slice old nick I swear,0,false,0,,,,,,
z13rd13pfkatx1d5e04cg1zwwwvmuhwgyc4,Luv11518,8 months ago,1454561846459,This movie was so good. Made me tear up a few times!,0,false,0,,,,,,
z13yxxcbyuvzvpyzi04chpua1kf0ctf4h0c,OG Sputnik Spyglass,8 months ago,1454561846460,just read the book,0,false,0,,,,,,
z13ofx5r1xjfupjji04cfbsy0x3ctjfjpkw0k,Rhaine Lopez,8 months ago,1454561846460,THIS IS ONE OF MY FAVORITE NOVELS,0,false,0,,,,,,
z125tlj5xurfwfksa232hddyvwmjwvaoq04,End my life,8 months ago,1454561846461,"Psh, 'the room' is better.",0,false,0,,,,,,
z12gyhtjlkqaghspc04ce3og2zugyxohacg,Daniel Ortiz,8 months ago,1454561846461,"Don't watch this trailer if you want to actually watch and enjoy the movie. It gives everything away! Trust me, I just watched the movie and saw this afterwards, I feel like I just watched it again.",0,false,0,,,,,,
z13xvnyqhkbnu54uf23qd3sppt33stx4w04,Andy E,8 months ago,1454561846461,Loved it!,0,false,0,,,,,,
z120t1phanneiffk3234hbfobujfvj3bz04,THXD 654,8 months ago,1454561846462,Soy el unico que habla en español?,0,false,0,,,,,,
z13jhzmiznietdjcr22kcr0jvzjbtlopn04,Jentany,8 months ago,1454561846462,Such a great film!,0,false,0,,,,,,
z13oglno2vrkih11g23gtbcrooryd1t0k,Rae Knowles,8 months ago,1454561846463,"what's the song where she says ""oh oh oh"" or whatever ?",1,true,1,,,,,,
,,,,,,,,z13oglno2vrkih11g23gtbcrooryd1t0k.1453929116934719,monika monikidou,8 months ago,1454561846854,+Rae Knowles MS MR All the things lost,0
z12of3pbjyzzevni304cgtz52qybjlshpfs,Lizkeep,8 months ago,1454561846463,"Just I saw the movie, so Great and touchy story, really tremendous actress Brie Larson, and the little actor Jacob Tremblay incredible",0,false,0,,,,,,
z13sgn4izuaxzjype04cc5bifz3vsncq3a4,Shabadrang Singh Khalsa,8 months ago,1454561846464,what´s the soundtrack of this trailer?,0,true,2,,,,,,
,,,,,,,,z13sgn4izuaxzjype04cc5bifz3vsncq3a4.1453929148416068,monika monikidou,8 months ago,1454561847053,+Shabadrang Singh Khalsa MS MR All the things lost,0
,,,,,,,,z13sgn4izuaxzjype04cc5bifz3vsncq3a4.1453983611233418,Shabadrang Singh Khalsa,8 months ago,1454561847053,thank you!! :),0
z13bfppbhzyuybj4c04cjjtrinanfdspwks0k,l337pwnage,8 months ago,1454561846464,ugh...women are insane.,0,true,1,,,,,,
,,,,,,,,z13bfppbhzyuybj4c04cjjtrinanfdspwks0k.1454898083878077,Celestial,7 months ago,1457067447256,+l337pwnage .. What does that even have to do with the video?,2
z12dtpnooqzafhdbi04cehfoyzish1czbxo0k,breakfast guru,8 months ago,1454561846465,"Spoil the movie why don't you.... Trailers nowadays... No respect anymore. Film was great though, just glad I saw it before I saw this trailer. I mean it doesn't ruin the film (because you've still got the incredible performances and the experience) but it certainly detracts from it. If you haven't seen the film yet then firstly GO SEE IT and secondly SEE IT BEFORE YOU SEE THIS TRAILER!!!",0,false,0,,,,,,
z13bzvohdubmuxawe04cdprapk3usnmi4ds,Advait Thakur,8 months ago,1454561846465,I'm excited to see this movie ! Seems a simple but great movie. Can someone tell me which song is this in the trailer?,0,false,0,,,,,,
z12sfzowakfyx1fad04cd3hrepjny1r4cis,Suhaeli,8 months ago,1454561846466,Thanks for make me cry. Great movie.,0,false,0,,,,,,
z12pf1ggklqpjt0mt22lcbpqxtjqgprjm04,Mohamed Sayed,8 months ago,1454561846466,"when I watched it , I cried. I recommend the film for anyone want to cry..... one of the best film in 2016.",0,false,0,,,,,,
z120fxhortmpcz1sf23qs3lpfkfustiv3,Fil Movie,8 months ago,1454561846467,Name of the song at the end of the trailer plese?,0,false,0,,,,,,
z134jzlrire4hxufb23dtxswatyiyfo4m04,Jessa,8 months ago,1454561846467,"Such impeccable acting from all of them. I really can't seem to get over how tremendous Jacob is at acting, and still so young! This movie moved me in so many ways, it was truly an emotional roller coaster to say the least. It's now up there with some of my favourites. I could say so many great things about it. I also want my very own Jacob, because he is just adorable.",0,false,0,,,,,,
z123crvoenbpetrpz04cdlzyfynzhptprew,OddOneOut665,8 months ago,1454561846468,"Oh Hai Brie Larson! Whoops, sorry, wrong movie.",0,false,0,,,,,,
z12ux3miowa4z5s5n04cdf4hrwrojbhgnaw,Lien Vandael,8 months ago,1454561848723,"I love this book, I love Brie Larson and that song!! Yes MS MR!!!!",0,false,0,,,,,,
z13ct5wjntfdclmns23nd5bzcwabiz5tj,H CRL,8 months ago,1454561848724,Hi can i have a dozen red roses please?,0,false,0,,,,,,
z13zxbvrpumnjlbyi04cih4ozx3ksxvwr5w,H CRL,8 months ago,1454561848725,She's showing everybody me underwears,0,false,0,,,,,,
z12xj1rruqytcjq3x22iiph4csn5j3jr004,Kevin McMahon,8 months ago,1454561848726,"Holy cow. I just saw this movie, and I cannot give it a higher praise. Best movie I have seen in a very long time. It is deeply emotional, and will probably make you cry. Excellent, in every way.",0,false,0,,,,,,
z13vcptphnnyynzq404cjbqyhzmzxfmxid0,Montage Matador,8 months ago,1454561848726,"Just watched this. What a fantastic film. I have never seen an action film that made my heart pump as fast as this film(which is not action). Great writing, great story. Fine performances. Certainly deserves the critical acclaim it has gotten. It will pull your emotions in, without doubt.",0,false,0,,,,,,
z13pujszeyz0e32mb22esbroim2fwzq5x04,Guest Informant,8 months ago,1454561848727,GIGANTIC SPOILER ALERT: This trailer destroys any suspense built up in the film. The movie is about 2 hours long and there are sequences in this trailer from right up to the end. Is this some kind of record?,0,false,0,,,,,,
z13jxx4bqsqtsxga104cjlkgiqeyxz2we5s,Blue Table Painting,8 months ago,1454561848727,AUGH! Right... in the... feels...,0,false,0,,,,,,
z12hzh3o0xvkxt1f122kdlezvxuvg12x004,Bohdan Bilas,8 months ago,1454561848728,"I thought this was a trailer for that Tommy Wiseau film, boy was I wrong",0,false,0,,,,,,
z133w34gzo2vwvmql04cjdyweyvwfvyp4bo,lola giljon,8 months ago,1454561848728,What's the name of the song at 1:58?,0,false,0,,,,,,
z12hhldzbxz3c1h1c23gclxzpzekxl33g,HD Pictures,8 months ago,1454561848729,I want to see this movie sooooo baaaaaaad,0,false,0,,,,,,
z12ivj4r1yqsx1zmo23eev3hkvyoxx2dj,Nayelli Baltimore,8 months ago,1454561848729,The book is amazing too,0,false,0,,,,,,
z13wxv5xzoevttvmo23zfbqz2rjocp3j104,Dean,8 months ago,1454561848730,"I've seen the movie two times but every time I come here (I don't even know why) I get so emotional. I don't know why but I think you can feel it inside your skin, the strength Ma had to take care of Jack and how hard she tried to adjust to the world and we would never know whether she successfully made it, but we know she's starting to get better and she's ready to travel the long road with Jack..... is the strength WE ALL WISHED FOR.",0,false,0,,,,,,
z12xxtqqxybgh1edw23kjlfjfvfdtv55q04,Alexys Rivers,8 months ago,1454561848730,Watch this,0,false,0,,,,,,
z13gwrzaenbeetoxa04chrz5owfhivoa2vc0k,Susan Bacon,8 months ago,1454561848731,I so enjoyed the book that I hope the movie captures it,0,false,0,,,,,,
z13kvppzgyqohvrg304ch35rbwamcvore4o,Lily Sanders Life Coach,8 months ago,1454561848731,Movie of the year,0,false,0,,,,,,
z12uungjjyape10zb04ch35rbwamcvore4o,Lily Sanders Life Coach,8 months ago,1454561848732,This is an award winning film. It was amazing and touching and riveting and beautiful.,0,false,0,,,,,,
z132f34i4ojmyjaoi04cfh5ytwvxht5ahac,Yuri Suzano Silva,8 months ago,1454561848733,"I like how it is called ""Room"". Not ""THE Room"".",0,false,0,,,,,,
z13js5gjhkerd3vpq04cir2o0yrrs3g5cxc0k,molly jermyn,8 months ago,1454561848734,I read thus book about 4 years ago and remember thinking it should be made into a movie. Such a good story.,0,false,0,,,,,,
z13wspjxkv3zwr5mf23le5mx5ou1zhhu2,Beckie Jane Brown,8 months ago (edited),1454561848734,This spoils everything. DO NOT WATCH BEFORE READING OR WATCHING THE FILM.,138,true,16,,,,,,
,,,,,,,,z13wspjxkv3zwr5mf23le5mx5ou1zhhu2.1453754433852465,8milesnake,8 months ago,1454561848949,+Beckie0 Haven't seen you since TFIOS video all the best with the hair.,1
,,,,,,,,z13wspjxkv3zwr5mf23le5mx5ou1zhhu2.1453926885534566,Diallo Banks,8 months ago,1454561848950,So true,0
,,,,,,,,z13wspjxkv3zwr5mf23le5mx5ou1zhhu2.1454192480904756,Mimi Mana,8 months ago,1454561848950,"it's based on the book though. I read the book before it was made into a movie so this wasn't really a spoiler for me. if anything, it must made me more excited for the movie lol",5
,,,,,,,,z13wspjxkv3zwr5mf23le5mx5ou1zhhu2.1454457538549158,Titus Orelius,8 months ago (edited),1454561848950,+Rebecca Brown fuck....too late -_-,2
,,,,,,,,z13wspjxkv3zwr5mf23le5mx5ou1zhhu2.1454463094922261,finalcountdown3210,8 months ago,1454561848951,WELP! That's fucking dumb,0
,,,,,,,,z13wspjxkv3zwr5mf23le5mx5ou1zhhu2.1454464534873295,Regina Phalange,8 months ago,1454561848951,+Rebecca Brown shoulda read the comment first,1
,,,,,,,,z13wspjxkv3zwr5mf23le5mx5ou1zhhu2.1454694901538986,Xaliber,7 months ago,1457067448952,+Rebecca Brown glad I read comments first,0
,,,,,,,,z13wspjxkv3zwr5mf23le5mx5ou1zhhu2.1454784942525219,Savannah Jones,7 months ago,1457067448952,How is the trailer a spoiler??? The fact you m kW they escape?? Did you read the book??? The actual room is maybe 1/4 of the plot line. It's not a story about captivity... It's about how hard it is for the mother and son to both adapt to life outside after over 5 years of isolation. The trailer spoils ABSOLUTELY NOTHING!,0
,,,,,,,,z13wspjxkv3zwr5mf23le5mx5ou1zhhu2.1454785131162989,8milesnake,7 months ago,1457067448953,"+Savannah Jones It does spoil the first 40 minutes, thank god i watched this movie without watching any trailer or reading anything about it. I enjoyed it a lot that way.",0
,,,,,,,,z13wspjxkv3zwr5mf23le5mx5ou1zhhu2.1454786516396519,Beckie Jane Brown,7 months ago,1457067448953,+Savannah Jones I have read the book.x,0
,,,,,,,,z13wspjxkv3zwr5mf23le5mx5ou1zhhu2.1455001171725357,entertain7us14,7 months ago,1457067448954,"+Rebecca Brown to me the trailer didn't actually reveal that she was raped, but 2 of my friends watched the trailer for the first time and picked it up immediately. Seriously, what part of the trailer even hints that she was raped? Or am I just really non-perceptive?",0
,,,,,,,,z13wspjxkv3zwr5mf23le5mx5ou1zhhu2.1455011579680839,Rory Walker,7 months ago,1457067448954,"+Rebecca Brown Bit late for that. Then again, I want to watch this movie specifically because I saw the trailer. I watch movies for the experience, not to know what happens next. Which is good, because entertain7us14 just spoiled things and their comment is what displays.",1
,,,,,,,,z13wspjxkv3zwr5mf23le5mx5ou1zhhu2.1455506499049733,Kongo Bongo,7 months ago,1457067448955,+Rebecca Brown i'm sooooo glad i didn't watch a trailer. holy shit,2
,,,,,,,,z13wspjxkv3zwr5mf23le5mx5ou1zhhu2.1455641812884400,rosekilledjack,7 months ago,1457067448955,Thank god I only watched a few seconds of the trailers and saw these comments. The movie was amazing.,0
,,,,,,,,z13wspjxkv3zwr5mf23le5mx5ou1zhhu2.1455747677880196,RON B,7 months ago,1457067448956,+Rebecca Brown argggghhhh Wish i read your comment b4 hand. Now i don't feel a need to see it .,0
,,,,,,,,z13wspjxkv3zwr5mf23le5mx5ou1zhhu2.1455845638343761,TheMariaMeep,7 months ago,1457067448956,Thank you!,0
z13oxhmytlzifppze04ccn1aika5ufkxyf0,Ryan Proctor,8 months ago,1454561848735,"****SPOILERS: Anyways, I loved the movie; thought it was great. My question was: Does anyone know why William H.Macy's character leaves and doesn't come back?. I thought of multiple reasons why but I couldn't quite find out why. Maybe I missed something. Does anyone know?",0,false,0,,,,,,
z12zgxyxitzmsxn3122qubgj2wjxwx3vb,Aissatouxo,8 months ago,1454561848736,I nearly cried just by watching the trailer😫😭,0,false,0,,,,,,
z124dfiabuzjtpete22oj5ohcrangbljw04,nfinn42,8 months ago,1454561848736,"Interesting trailer. Can anyone tell me, about how much of the movie is spent in ""the room"" and how much is spent after their escape? Because the trailer seems to imply that the majority of the movie is devoted to their escape, recovery, and healing. If so, I find that particularly impressive. Typically, your ""abduction by bad guy"" plot line shows capture, lingers over abuse, and only shows escape as the final scene. Issues such as recovery, healing, and lasting trauma from the abuse are often ignored because they don't fit into the sort of simplistic tension-climax-resolution dramatic arc moviemakers are used to. But by centralizing the abuser I think such stories give abusers more power and attention than they deserve. There ought to be more movies where the abuser is not centralized but rather the story is about the victims and how they rebuild their lives and become survivors afterwards. That's where the real story is.",0,false,0,,,,,,
z133wvdwgybvcfi1r23mx3to5qfndpdmb,sarah854r4h,8 months ago,1454561848737,"this movie is so heartbreaking Jacob Tremblay the little boy is incredible and Brie Larson is so brilliant,",0,false,0,,,,,,
z121s33g2nnbgn3bt04ci10qmx2ryb0qcac,Claire Scott,8 months ago,1454561848738,I'm 9 and I loved the storyline to this movie it was truly amazIng. But the things that can happen in this world today is totally disturbing,0,false,0,,,,,,
z13wv5ur1uefvbhve22xvvspapvxu3pfs,KnightofDuroch,8 months ago,1454561848738,"Let this be a lesson in how NOT to make a trailer. Not only does it straight-up tell you everything that happens, it somehow does this without really showing how the movie feels, ie. that the whole story is expressed primarily from a child's POV. This makes it look so goddamn conventional, like a shmoopy Lifetime movie. Blah The movie is fucking amazing tho. I was totally demolished. I haven't been blown away by an indie like this since WHIPLASH.",0,false,0,,,,,,
z123cdlg2zr0ct2no22wxhrylljaw5r0g,Paige Weigle,8 months ago,1454561848739,Is anyone else here because of Tyler and Josh?,0,false,0,,,,,,
z12uzt45oqrhixffu221u5piiwndzvm4u04,ilectra V,8 months ago,1454561848739,the most adorable kid I've ever seen! loved the movie.,0,false,0,,,,,,
z12meffbcpqjunlet22idxh4tzz2ynn4v04,Mitchell Watanabe,8 months ago,1454561848740,Where can I find this movie?,0,false,0,,,,,,
z13vxzlzssqssvnom04cgnhbdkepstsj0m40k,vbobkovsky,8 months ago,1454561848740,And the Oscar for Best Actress goes to...,312,true,31,,,,,,
,,,,,,,,z13vxzlzssqssvnom04cgnhbdkepstsj0m40k.1453664780708814,Tayabax,8 months ago,1454561849252,My ass,14
,,,,,,,,z13vxzlzssqssvnom04cgnhbdkepstsj0m40k.1453704381603776,radtemmie,8 months ago,1454561849253,this pussy,9
,,,,,,,,z13vxzlzssqssvnom04cgnhbdkepstsj0m40k.1454010750126237,T.E.D,8 months ago,1454561849253,larson's clevage,6
,,,,,,,,z13vxzlzssqssvnom04cgnhbdkepstsj0m40k.1454204474539006,Make-Make,8 months ago,1454561849254,+vbobkovsky I hope so! She did a phenomenal job in this movie.,2
,,,,,,,,z13vxzlzssqssvnom04cgnhbdkepstsj0m40k.1454213599160024,Diallo Banks,8 months ago,1454561849254,"it might be Jeniffer Lawrence tho.....I didn't see Joy but, Jeniffer Lawrence is like one of the best actresses of this century......like really. but as far as I know Brie Larson should get it. I hope she does",1
,,,,,,,,z13vxzlzssqssvnom04cgnhbdkepstsj0m40k.1454524761304943,Amber Sophie,8 months ago,1454561849255,"+Diallo Banks i actually think it will go to jeniffer Not because she was better , just because she is jeniffer LAWRENCE ! You get what i mean ?",1
,,,,,,,,z13vxzlzssqssvnom04cgnhbdkepstsj0m40k.1454898173391936,Celestial,7 months ago (edited),1457067449255,"+Diallo Banks Nah, Jennifer has like no chance at winning. She was fighting to just get nominated since the critics trashed Joy. If anyone can beat Brie, it's Saoirse Ronan, but that's by a long shot.",12
,,,,,,,,z13vxzlzssqssvnom04cgnhbdkepstsj0m40k.1455843374881670,Creme De La Creme,7 months ago,1457067449256,Its a long shot but I'm still kinda rooting for Saoirse Ronan even though its pretty unlikely. Still I'll be happy with Brie taking it she did amazing after all.,0
,,,,,,,,z13vxzlzssqssvnom04cgnhbdkepstsj0m40k.1456251606717348,Icicle Jr,7 months ago,1457067449257,A guy pretending to be a girl,1
,,,,,,,,z13vxzlzssqssvnom04cgnhbdkepstsj0m40k.1456294529947303,Agnostic,7 months ago,1457067449257,+vbobkovsky not even close,0
,,,,,,,,z13vxzlzssqssvnom04cgnhbdkepstsj0m40k.1456376268414823,T.E.D,7 months ago,1457067449258,"yeah, a shitty actor being melodramamatic for the sake of being melodramatic.",0
,,,,,,,,z13vxzlzssqssvnom04cgnhbdkepstsj0m40k.1456700532520665,Diallo Banks,7 months ago,1457067449258,+T.E.D brie should still get it,0
,,,,,,,,z13vxzlzssqssvnom04cgnhbdkepstsj0m40k.1456721371448688,Natalie Reed,7 months ago,1457067449259,Brie Larson! 👏👏👏👏👏,11
,,,,,,,,z13vxzlzssqssvnom04cgnhbdkepstsj0m40k.1456722706399095,Blue_lagoon,7 months ago,1457067449259,Wow!!! You were right! Screw everyone in the comments who thought wrong (;,12
,,,,,,,,z13vxzlzssqssvnom04cgnhbdkepstsj0m40k.1456722755944912,Natalie Reed,7 months ago,1457067449260,☝what he said,1
,,,,,,,,z13vxzlzssqssvnom04cgnhbdkepstsj0m40k.1456731361254523,Deepali deshmukh,7 months ago,1457067449260,+vbobkovsky awesome (Y),0
,,,,,,,,z13vxzlzssqssvnom04cgnhbdkepstsj0m40k.1456739281030498,Sophie Mariff,7 months ago,1457067449261,+vbobkovsky SHE DID WIN AN OSCAR FOR THIS OMG,20
,,,,,,,,z13vxzlzssqssvnom04cgnhbdkepstsj0m40k.1456787763258316,Skittle 1661,7 months ago,1457067449261,+Tayabax you were wrong,0
,,,,,,,,z13vxzlzssqssvnom04cgnhbdkepstsj0m40k.1456869082725230,Brahim Bha,7 months ago,1457067449262,+Tayabax so what? ;),0
,,,,,,,,z13vxzlzssqssvnom04cgnhbdkepstsj0m40k.1456918073313895,Carl The Last String Bender,7 months ago,1457067449262,She just won the Oscar. What a brilliant actress.,10
,,,,,,,,z13vxzlzssqssvnom04cgnhbdkepstsj0m40k.1456951235578893,lord gogo,7 months ago,1457067449263,+vbobkovsky to me,0
,,,,,,,,z13vxzlzssqssvnom04cgnhbdkepstsj0m40k.1457637771553387,Romary Rosado Cordero,6 months ago,1459745849264,what is her name ? disculpa mi inglés jaja 😓😂,0
,,,,,,,,z13vxzlzssqssvnom04cgnhbdkepstsj0m40k.1457932704602723,Melissa H S,6 months ago,1459745849264,+Romary Rosado Cordero Brie Larson,0
,,,,,,,,z13vxzlzssqssvnom04cgnhbdkepstsj0m40k.1457984212763637,msg Lindon,6 months ago,1459745849265,+Melissa H S اني من العراق ومدا افهم شي من التعليقات,0
,,,,,,,,z13vxzlzssqssvnom04cgnhbdkepstsj0m40k.1458166461784747,MAHA ALASMARI.,6 months ago,1459745849265,+msg Lindon طيب تعلق ليه؟.,2
,,,,,,,,z13vxzlzssqssvnom04cgnhbdkepstsj0m40k.1458695160382102,abdullah_1saeed,6 months ago,1459745849266,+Maha alasmari هههههههههههه يوه ذا مجنون,0
,,,,,,,,z13vxzlzssqssvnom04cgnhbdkepstsj0m40k.1459300950464936,Red,6 months ago,1459745849266,Tommy Wiseau,3
,,,,,,,,z13vxzlzssqssvnom04cgnhbdkepstsj0m40k.1459433621655902,bader otibi,6 months ago,1459745849267,to me,2
,,,,,,,,z13vxzlzssqssvnom04cgnhbdkepstsj0m40k.1459443881096711,GoDGiVeN,6 months ago,1459745849267,+Red hahahahahahahahahahah,0
,,,,,,,,z13vxzlzssqssvnom04cgnhbdkepstsj0m40k.1462569806541235,Ahmed Aljunaibi,4 months ago,1465016249268,Old nick,0
,,,,,,,,z13vxzlzssqssvnom04cgnhbdkepstsj0m40k.1465788391313112,In Star Wars 7 Luke skywalker has a robot hand,3 months ago,1467608249269,DEEZ nuts,8
z13ncpbyazihjlzrl04chvqyxmr0xld5rrk0k,Jessie K,8 months ago,1454561848742,"This movie should be given Best Picture at the Oscars really. And Brie for Best Actress. I have watched this movie 7 times and each time it broke my heart. Very inspiring, a true testament to the power of the human spirit. Even when it breaks it finds a way to repair itself and hope for the better again. And Jacob Tremblay, I have no words to describe how amazing you were. You're a phenomenon unto yourself.",0,false,0,,,,,,
z13qcrkzhkrqhtmuc224vpmxtsanthxxi04,brenda gimenez,8 months ago,1454561848742,quiero ir a verlaaaaaaaaaaaaaaaaa,0,false,0,,,,,,
z13ngzkbctyehd0ar04cg5fpgnq5tzba2ws0k,EndZiiel,8 months ago,1454561848743,Obviously they get out ffs!! Shouldn't of watched the trailer damn it,0,false,0,,,,,,
z12lifmisqbow3mjx04cdbqyrmedxpy4cg0,lana marie,8 months ago,1454561848744,Cries hard at trailer. Movie's gonna destroy me. Won't see at cinema. Brie Larson is amazing. MS MR is life 🙌🏼,0,false,0,,,,,,
z121gtqwgxekvd1df231snm5aueftr4qk04,Jenna Denjern,8 months ago,1454561848744,"Phenomenal movie. Brie Larson did a fantastic, wonderful job. If she doesn't get the Oscar for this role, it'll be the biggest crime.",0,false,0,,,,,,
z13jz5zx4zj2vbalc22rerdaaxjzvlfvc,leonthesleepy,8 months ago,1454561848745,Movie was absolutely amazing!!! Not sure how to feel about this trailer tho! It shows a little too much and i recommend going into the movie blind! Its heartbreaking in the best way possible.,0,false,0,,,,,,
z12ytjligmasw1wcc22jdpiwrsnrurx3h,Seventy Eight,8 months ago,1454561848745,"Jacob Tremblay so deserved a Best Actor nomination, what the hell happened? Why was he being considered for a Best Supporting Actor, and then he didn't even get that? The book is told from his perspective it is about a kid who never experienced the world, and his struggles, not to mention he is in every scene of the movie and carries the movie whenever Brie Larson wasn't there. But with this movie under his belt he'll definitely get an academy award eventually.",0,false,0,,,,,,
z121ujih3ty4jpus322hynyiwuvye3hnf,Kirsten Reddoch,8 months ago,1454561848746,This movie was Amazing. now i really want to know how their lives turn out.,0,false,0,,,,,,
z12scxr4tmvout20122jin5ofzutwbiir04,SEO LOCOo,8 months ago,1454561848746,inspired from north korea?,0,false,0,,,,,,
z13hyjbrtyv5vfvs523nzvvr0qv5vni2a,Wojciech Oszczakiewicz,8 months ago,1454561848747,Best Movie Ever,0,false,0,,,,,,
z12wxxhxepi0zjc1f232ixlwvsqkgtvvg,Yuki sama,8 months ago,1454561848747,i like the song,0,false,0,,,,,,
z13qd5cajvqiyncbq04cehrx0ofgwdaa3m00k,Chrisko1492,8 months ago,1454561848748,"ok, i got goosebumps just from the trailer. is the actual movie even more moving?",0,false,0,,,,,,
z135hvwywoyxhrisx22qdnao2tzjejyys04,Achenar Spire,8 months ago,1454561848748,Must have got inspiration from the three women kidnapped in Cleveland.,0,false,0,,,,,,
z122grnjpwynstqqj04cffxzoti5hzrq3ko0k,ajax201000,8 months ago,1454561848749,"doesn't this trailer kind of ruin that she escapes, why would you show this",0,true,4,,,,,,
,,,,,,,,z122grnjpwynstqqj04cffxzoti5hzrq3ko0k.1453374377375837,Kaptain Kappa,8 months ago,1454561849426,+ajax201000 it seems the movie is moreso about how they readjust to society as opposed to them being trapped,6
,,,,,,,,z122grnjpwynstqqj04cffxzoti5hzrq3ko0k.1454075222360170,ajax201000,8 months ago,1454561849426,so the least interesting aspects,0
,,,,,,,,z122grnjpwynstqqj04cffxzoti5hzrq3ko0k.1460277182517538,jamie456781,5 months ago,1462337849427,+Kaptain Kappa Still so stupid of a trailer. It's still a major spoiler they give away.,0
,,,,,,,,z122grnjpwynstqqj04cffxzoti5hzrq3ko0k.1460301587045566,Kaptain Kappa,5 months ago,1462337849439,"+jamie456781 true, but I'd say its more stupid to advertise only the first third of a movie",0
